{"schema_version":1,"decision_id":"permission:permission-request-1","object_version":1,"status":"approved","classification":"allowed_autonomous","action":"direction_card.generate","actor":{"actor_id":"project-host","actor_kind":"project_host"},"subject_ref":{"object_type":"creative_contract","object_id":"contract-1","object_version":2,"digest":"aaaaaaaaaaaaaaaaaaaaaaaaaaaaaaaaaaaaaaaaaaaaaaaaaaaaaaaaaaaaaaaa"},"context_refs":[{"object_type":"material_evidence_pack","object_id":"pack-1","object_version":1,"digest":"bbbbbbbbbbbbbbbbbbbbbbbbbbbbbbbbbbbbbbbbbbbbbbbbbbbbbbbbbbbbbbbb"}],"policy_snapshot_ref":{"object_id":"stage2-permission-policy","object_version":1,"digest":"cccccccccccccccccccccccccccccccccccccccccccccccccccccccccccccccc"},"effect_digest":"eeeeeeeeeeeeeeeeeeeeeeeeeeeeeeeeeeeeeeeeeeeeeeeeeeeeeeeeeeeeeeee","approval_requirement":"none","allowed_data_fields":["audit_metadata","bounded_context","candidate"],"affected_scope":["creative_contract:contract-1@2#aaaaaaaaaaaaaaaaaaaaaaaaaaaaaaaaaaaaaaaaaaaaaaaaaaaaaaaaaaaaaaaa","material_evidence_pack:pack-1@1#bbbbbbbbbbbbbbbbbbbbbbbbbbbbbbbbbbbbbbbbbbbbbbbbbbbbbbbbbbbbbbbb"],"failure_result":"candidate_discarded","reason_code":"HOST_DERIVED_CANDIDATE","request_reason":"generate a bounded candidate","input_fingerprint":"dddddddddddddddddddddddddddddddddddddddddddddddddddddddddddddddd","created_at":"2026-08-24T02:00:00Z","provenance":{"producer":"project-host","source_version":"permission-enforcement-v1","policy_version":"stage2-permission-policy-v1","input_refs":["cccccccccccccccccccccccccccccccccccccccccccccccccccccccccccccccc","aaaaaaaaaaaaaaaaaaaaaaaaaaaaaaaaaaaaaaaaaaaaaaaaaaaaaaaaaaaaaaaa","bbbbbbbbbbbbbbbbbbbbbbbbbbbbbbbbbbbbbbbbbbbbbbbbbbbbbbbbbbbbbbbb"]}}
